{
  "$schema": "https://json-schema.org/draft/2020-12/schema",
  "$id": "https://github.com/sashkinbro/EmuCoreD-Textures/schemas/texture-catalog.schema.json",
  "title": "EmuCoreD 3DS texture catalog",
  "type": "object",
  "required": [
    "schemaVersion",
    "platform",
    "generatedAt",
    "entries"
  ],
  "properties": {
    "schemaVersion": {
      "const": 1
    },
    "platform": {
      "const": "azahar"
    },
    "generatedAt": {
      "type": "string",
      "format": "date-time"
    },
    "entries": {
      "type": "array",
      "items": {
        "type": "object",
        "required": [
          "id",
          "name",
          "gameTitle",
          "version",
          "authors",
          "downloadUrl",
          "sourceUrl",
          "license",
          "distribution"
        ],
        "properties": {
          "id": {
            "type": "string",
            "minLength": 1
          },
          "name": {
            "type": "string",
            "minLength": 1
          },
          "gameTitle": {
            "type": "string",
            "minLength": 1
          },
          "titleIds": {
            "type": "array",
            "minItems": 0,
            "items": {
              "type": "string",
              "pattern": "^[0-9A-F]{16}$"
            }
          },
          "version": {
            "type": "string",
            "minLength": 1
          },
          "authors": {
            "type": "array",
            "minItems": 1,
            "items": {
              "type": "string",
              "minLength": 1
            }
          },
          "credits": {
            "type": "string"
          },
          "description": {
            "type": "string"
          },
          "downloadUrl": {
            "type": "string",
            "format": "uri"
          },
          "sourceUrl": {
            "type": "string",
            "format": "uri"
          },
          "license": {
            "type": "string",
            "minLength": 1
          },
          "distribution": {
            "enum": [
              "link-only",
              "mirrored"
            ]
          },
          "sizeBytes": {
            "type": "integer",
            "minimum": 1,
            "maximum": 17179869184
          },
          "sha256": {
            "type": "string",
            "pattern": "^[0-9A-Fa-f]{64}$"
          },
          "fileCount": {
            "type": "integer",
            "minimum": 1,
            "maximum": 50000
          },
          "previewUrls": {
            "type": "array",
            "items": {
              "type": "string",
              "format": "uri"
            }
          },
          "sourceRelease": {
            "type": "string"
          },
          "updatedAt": {
            "type": "string",
            "format": "date-time"
          }
        },
        "additionalProperties": false
      }
    }
  },
  "additionalProperties": false
}
